{
  "name": "web-files-file-upload-patterns",
  "version": "1.0.0",
  "skills": "./skills/",
  "description": "File upload patterns - drag-drop dropzones, chunked/resumable uploads, S3 presigned URLs, file validation (MIME type, magic bytes), progress tracking, image preview, accessibility (ARIA)",
  "author": {
    "name": "@vince"
  },
  "keywords": [
    "file-upload",
    "drag-drop",
    "react-dropzone",
    "uppy",
    "tus-protocol",
    "s3-presigned",
    "multipart-upload",
    "file-validation",
    "progress-tracking",
    "accessibility"
  ]
}