{
  "name": "api-analytics-posthog-analytics",
  "version": "1.0.0",
  "skills": "./skills/",
  "description": "PostHog event tracking, user identification, group analytics for B2B, GDPR consent patterns. Use when implementing product analytics, tracking user behavior, setting up funnels, or configuring privacy-compliant tracking.",
  "author": {
    "name": "@vince"
  },
  "keywords": [
    "posthog",
    "analytics",
    "event-tracking",
    "user-identification"
  ]
}