{
  "name": "web-pwa-service-workers",
  "version": "1.0.0",
  "skills": "./skills/",
  "description": "Service Worker lifecycle, caching strategies, offline patterns, update handling, precaching, runtime caching",
  "author": {
    "name": "@vince"
  },
  "keywords": [
    "service-worker",
    "pwa",
    "offline-first",
    "cache-first",
    "network-first",
    "stale-while-revalidate",
    "cache-api",
    "precache"
  ]
}