{
  "name": "web-realtime-socket-io",
  "version": "1.0.0",
  "skills": "./skills/",
  "description": "Socket.IO v4.x client patterns, connection lifecycle, reconnection, authentication, rooms, namespaces, acknowledgments, binary data, TypeScript integration",
  "author": {
    "name": "@vince"
  },
  "keywords": [
    "socket-io",
    "realtime",
    "bidirectional",
    "rooms",
    "namespaces",
    "acknowledgments",
    "connection-management",
    "reconnection",
    "authentication",
    "binary-data",
    "typescript"
  ]
}