{
  "name": "web-forms-react-hook-form",
  "version": "1.0.0",
  "skills": "./skills/",
  "description": "React Hook Form patterns - useForm, Controller, useFieldArray, validation resolver, performance optimization",
  "author": {
    "name": "@vince"
  },
  "keywords": [
    "forms",
    "react-hook-form",
    "use-form",
    "use-field-array",
    "controller",
    "validation"
  ]
}