{
  "name": "web-framework-remix",
  "version": "1.0.0",
  "skills": "./skills/",
  "description": "File-based routing, loaders, actions, defer streaming, useFetcher, error boundaries, progressive enhancement",
  "author": {
    "name": "@vince"
  },
  "keywords": [
    "remix",
    "remix-v2",
    "react-router-v7",
    "react-router",
    "react",
    "full-stack",
    "ssr",
    "loaders",
    "actions",
    "client-action",
    "single-fetch",
    "progressive-enhancement"
  ]
}