{
  "name": "cli-framework-oclif-ink",
  "version": "1.0.0",
  "skills": "./skills/",
  "description": "Modern CLI development combining oclif's command framework with Ink's React-based terminal rendering",
  "author": {
    "name": "@vince"
  },
  "keywords": [
    "cli",
    "oclif",
    "ink",
    "react",
    "terminal",
    "framework"
  ]
}