{
  "name": "web-framework-nextjs-app-router",
  "version": "1.0.0",
  "skills": "./skills/",
  "description": "Next.js 15 App Router patterns - file-based routing, Server/Client Components, streaming, Suspense, metadata API, parallel routes, Turbopack, async params",
  "author": {
    "name": "@vince"
  },
  "keywords": [
    "nextjs",
    "app-router",
    "server-components",
    "streaming",
    "suspense",
    "ssr",
    "ssg",
    "routing"
  ]
}