{
  "name": "web-framework-angular-standalone",
  "version": "1.0.0",
  "skills": "./skills/",
  "description": "Angular 17-19 standalone components, signals, control flow, dependency injection patterns",
  "author": {
    "name": "@vince"
  },
  "keywords": [
    "angular",
    "angular-19",
    "standalone",
    "signals",
    "linked-signal",
    "resource",
    "components",
    "control-flow",
    "dependency-injection"
  ]
}