{
  "name": "web-data-fetching-trpc",
  "version": "1.0.0",
  "skills": "./skills/",
  "description": "tRPC type-safe API patterns, procedures, React Query integration",
  "author": {
    "name": "@vince"
  },
  "keywords": [
    "trpc",
    "type-safe-api",
    "react-query",
    "typescript",
    "monorepo",
    "rpc"
  ]
}