{
  "name": "web-testing-cypress-e2e",
  "version": "1.0.0",
  "skills": "./skills/",
  "description": "Cypress E2E testing patterns - test structure, data-cy selectors, cy.intercept() mocking, custom commands, fixtures, component testing, accessibility testing with cypress-axe, and CI/CD integration",
  "author": {
    "name": "@vince"
  },
  "keywords": [
    "cypress",
    "e2e",
    "end-to-end",
    "browser-testing",
    "component-testing",
    "data-cy",
    "cy-intercept",
    "cypress-axe"
  ]
}