{
  "name": "meta-reviewing-cli-reviewing",
  "version": "2.0.0",
  "skills": "./skills/",
  "description": "CLI code review patterns. Use when reviewing CLI applications built with Commander.js, @clack/prompts, picocolors. Covers exit codes, signal handling, error messages, user experience, testing adequacy.",
  "author": {
    "name": "@vince"
  },
  "keywords": [
    "cli",
    "review",
    "commander",
    "clack",
    "exit-codes",
    "signal-handling",
    "error-handling",
    "user-experience",
    "methodology"
  ]
}