{
  "name": "web-testing-react-testing-library",
  "version": "1.0.0",
  "skills": "./skills/",
  "description": "React Testing Library patterns - query hierarchy, userEvent, async utilities, renderHook, custom render with providers, accessibility-first testing",
  "author": {
    "name": "@vince"
  },
  "keywords": [
    "react-testing-library",
    "testing",
    "component-testing",
    "accessibility",
    "user-event",
    "queries",
    "async-testing",
    "render-hook"
  ]
}