{
  "name": "web-accessibility-web-accessibility",
  "version": "1.0.0",
  "skills": "./skills/",
  "description": "WCAG, ARIA, keyboard navigation",
  "author": {
    "name": "@vince"
  },
  "keywords": [
    "wcag",
    "wcag-22",
    "aria",
    "keyboard-navigation",
    "a11y",
    "accessibility",
    "screen-reader",
    "axe-core",
    "jest-axe",
    "vitest-axe",
    "cypress-axe",
    "prefers-reduced-motion",
    "focus-management"
  ]
}