{
  "name": "web-i18n-vue-i18n",
  "version": "1.0.0",
  "skills": "./skills/",
  "description": "Type-safe i18n for Vue 3 Composition API",
  "author": {
    "name": "@vince"
  },
  "keywords": [
    "vue-i18n",
    "i18n",
    "internationalization",
    "localization",
    "translations",
    "vue-3",
    "composition-api",
    "pluralization"
  ]
}