{
  "name": "web-state-jotai",
  "version": "1.0.0",
  "skills": "./skills/",
  "description": "Atomic state management with auto-dependency tracking",
  "author": {
    "name": "@vince"
  },
  "keywords": [
    "jotai",
    "state-management",
    "atoms",
    "client-state",
    "atomic-state"
  ]
}