{
  "name": "web-testing-vue-test-utils",
  "version": "1.0.0",
  "skills": "./skills/",
  "description": "Vue Test Utils patterns - mount, shallowMount, wrapper API, trigger, setValue, flushPromises, testing composables, Pinia store mocking",
  "author": {
    "name": "@vince"
  },
  "keywords": [
    "vue-test-utils",
    "testing",
    "component-testing",
    "mount",
    "shallow-mount",
    "wrapper",
    "trigger",
    "set-value",
    "flush-promises",
    "composables",
    "pinia-testing"
  ]
}