{
  "name": "web-utilities-date-fns",
  "version": "1.0.0",
  "skills": "./skills/",
  "description": "date-fns patterns for TypeScript - formatting, parsing, manipulation, comparison, timezone handling, and internationalization",
  "author": {
    "name": "@vince"
  },
  "keywords": [
    "date-fns",
    "dates",
    "time",
    "formatting",
    "parsing",
    "timezone",
    "internationalization",
    "manipulation"
  ]
}